### ISSUE TITLE
Inter-container traffic always NAT'd post-packer change?

### ISSUE THREAD

**Issue by james-masson** [cloudfoundry/bosh-lite#193]
Pre-packer ( eg. box 237 ) the NAT rules between containers was something like...

```
Chain warden-postrouting (1 references)
 pkts bytes target     prot opt in     out     source               destination         
    0     0 MASQUERADE  all  --  *      *       10.244.0.0/19       !10.244.0.0/19       
```

This meant all inter-container traffic was direct routed.

Post-packer ( eg. head or box 293 ), the NAT rules seem to be SNATing all inter-container traffic.

```
Chain w--postrouting (1 references)
 pkts bytes target     prot opt in     out     source               destination         
    0     0 SNAT       all  --  *      *       10.244.0.0/16        0.0.0.0/0            to:10.0.2.15
```

This means that all traffic comes with a source of the wrong IP.

```
root@ad1f9e9f-7384-470a-af05-0eb5949fb407:~# tcpdump -nni w5movi9acqir-1 icmp
tcpdump: verbose output suppressed, use -v or -vv for full protocol decode
listening on w5movi9acqir-1, link-type EN10MB (Ethernet), capture size 65535 bytes
10:32:15.631798 IP 10.0.2.15 > 10.244.10.6: ICMP echo request, id 149, seq 18, length 64
10:32:15.631938 IP 10.244.10.6 > 10.0.2.15: ICMP echo reply, id 149, seq 18, length 64
10:32:16.631908 IP 10.0.2.15 > 10.244.10.6: ICMP echo request, id 149, seq 19, length 64
10:32:16.632160 IP 10.244.10.6 > 10.0.2.15: ICMP echo reply, id 149, seq 19, length 64
10:32:17.633047 IP 10.0.2.15 > 10.244.10.6: ICMP echo request, id 149, seq 20, length 64
10:32:17.633268 IP 10.244.10.6 > 10.0.2.15: ICMP echo reply, id 149, seq 20, length 64
10:32:18.632100 IP 10.0.2.15 > 10.244.10.6: ICMP echo request, id 149, seq 21, length 64
10:32:18.632331 IP 10.244.10.6 > 10.0.2.15: ICMP echo reply, id 149, seq 21, length 64
10:32:19.633623 IP 10.0.2.15 > 10.244.10.6: ICMP echo request, id 149, seq 22, length 64
10:32:19.633883 IP 10.244.10.6 > 10.0.2.15: ICMP echo reply, id 149, seq 22, length 64

```

This may work with traffic that doesn't imply meaning from source/destination IP, but will confuse applications that rely on this.

Is this SNAT deliberate? I wouldn't normally expect this behaviour on real networks.

thanks

James M

**Comment by jpalermo** [comment]
@cppforlife We're still having this problem, but now it is inconsistent across infrastructures. Everything works fine on virtualbox but when using bosh lite on aws we are still seeing the above problem.

**Comment by jpalermo** [comment]
We were wrong about it being inconsistent across infrastructures. Created a PR to address the issue:
https://github.com/cloudfoundry/bosh-lite/pull/364
